{
  "$schema": "https://json-schema.org/draft/2020-12/schema",
  "title": "Source",
  "description": "信源登记表条目：collector agent 的扫描清单",
  "type": "object",
  "required": ["id", "name", "url", "cadence", "lang", "what_to_look_for_zh"],
  "properties": {
    "id": { "type": "string", "pattern": "^[a-z0-9][a-z0-9-]+$" },
    "name": { "type": "string", "minLength": 1 },
    "url": { "type": "string", "pattern": "^https?://" },
    "cadence": { "enum": ["daily", "weekly", "biweekly", "monthly", "quarterly", "yearly", "biennial", "event_driven"] },
    "lang": { "enum": ["zh", "en"] },
    "what_to_look_for_zh": { "type": "string", "minLength": 1 },
    "last_checked": { "type": "string", "pattern": "^\\d{4}-\\d{2}-\\d{2}$" }
  }
}
